{
  "composition": "aether-edge-six-service",
  "aether_version": "0.0.2",
  "target_triple": "aarch64-unknown-linux-musl",
  "target_os": "linux",
  "services": [
    "aether-alarm",
    "aether-api",
    "aether-automation",
    "aether-history",
    "aether-io",
    "aether-uplink"
  ],
  "cargo_features": [
    "aether-io/can",
    "aether-io/gpio",
    "aether-io/iec61850",
    "aether-io/modbus"
  ],
  "capabilities": [
    "alarm.alert.resolve",
    "alarm.rule.manage",
    "automation.instance.manage",
    "automation.routing.manage",
    "automation.rule.execute",
    "automation.rule.manage",
    "data_processing.process",
    "data_processing.processors.health",
    "data_processing.tasks.list",
    "device.command_outcome.read",
    "device.read_point",
    "device.write_point",
    "io.channel.manage",
    "io.channel.reconcile"
  ],
  "protocols": [
    "can",
    "di_do",
    "iec61850",
    "modbus_rtu",
    "modbus_tcp"
  ],
  "checksum": {
    "algorithm": "sha256",
    "digest": "fae4c1e9b61c2d6eebb2f24093c035a1305ce29d80a0d5a2b435922455d76bf8"
  }
}
